{
  "protocolId": "VP-HW2-REPRESENTATIVE-QUALIFICATION-PROTOCOL-v2",
  "schemaVersion": "VP-HW2-REPRESENTATIVE-QUALIFICATION-PROTOCOL-SCHEMA-v2",
  "parentContractId": "VP-A8R-HW1-MACHINE-CONTRACT-v2",
  "supersedesMeasurementProtocolId": "VP-HW2-RESULT-BLIND-QUALIFICATION-PROTOCOL-v1",
  "classification": "result-blind-representative-hardware-qualification-only",
  "pr2Decision": {
    "commit": "d079d933c3afdfd78927ca857bdb94d784e085cf",
    "relativePath": "90_候选工作区/current/G0_全项目完成度与实验前暂停治理/07_PR2_HW2测量语义执行架构与全项目后续裁决.md",
    "sha256": "2631cda368e04d0d100150170b7eff5551d81e8305953915881a3a615931d4a1",
    "acceptedV1Code": "ACCEPT-HW2-V1-AS-COMPLETE-SYNTHETIC-HARNESS-COVERAGE-SAFETY-AND-DETERMINISM-EVIDENCE",
    "inconclusiveV1SelectionCode": "CLASSIFY-HW2-V1-CANDIDATE-SELECTION-AS-INCONCLUSIVE-MEASUREMENT-SEMANTICS",
    "requiredV2Code": "REQUIRE-HW2R-V2-CANDIDATE-SCALED-REPRESENTATIVE-FULL-MATRIX-REQUALIFICATION",
    "h3LockCode": "KEEP-HW1-PRIMARY-HW1-REPEAT-AND-H3-LOCKED"
  },
  "freeze": {
    "repositoryBaseCommit": "6e27bf2cb7c6e1679d96a1d5bdd776ecd59ed8a6",
    "resultBlind": true,
    "candidateCodeCommittedBeforePerformanceObservation": true,
    "cleanMainParityRequired": true,
    "fullResultBearingRunForbidden": true,
    "scientificPayloadHumanReadForbidden": true,
    "scientificValuePersistenceForbidden": true,
    "canonicalA8rArtifactWriteForbidden": true,
    "runtimeFallbackForbidden": true,
    "v1FilesImmutable": true,
    "formalTheoryAndProgramImmutable": true,
    "protocolMutationAfterFormalRepeatForbidden": true
  },
  "fieldBoundary": {
    "allowed": [
      "identity-hash",
      "equality-boolean",
      "timing",
      "throughput",
      "speedup",
      "resource-field",
      "safety-field",
      "measurement-validity",
      "candidate-classification",
      "machine-auditable-failure"
    ],
    "forbidden": [
      "drag",
      "lift",
      "torque",
      "power",
      "pressure",
      "velocity-field",
      "period",
      "frequency",
      "strouhal",
      "phase",
      "spectrum",
      "scientific-margin",
      "scientific-decision",
      "literature-distance"
    ]
  },
  "calibration": {
    "maximumShortCalibrationsPerCandidate": 3,
    "shortCalibrationTargetSeconds": 2,
    "formalTargetSecondsMinimum": 20,
    "formalTargetSecondsMaximum": 45,
    "formalHardSecondsMinimum": 15,
    "formalHardSecondsMaximum": 60,
    "validFormalRepeats": 3,
    "warmupBatchesMinimum": 2,
    "batchScaleRule": "ceil(previousBatchCount*clamp(20/medianSeconds,1.25,16))",
    "batchScaleMustStrictlyIncrease": true,
    "formalBatchFrozenAfterCalibration": true,
    "formalRepeatWorkMustBeIdentical": true,
    "tooShortClassification": "MEASUREMENT_INVALID-WORKLOAD-TOO-SHORT",
    "tooLongClassification": "MEASUREMENT_INVALID-WORKLOAD-TOO-LONG"
  },
  "lifecyclePhases": [
    "build-or-provision",
    "cold-process-or-device-initialization",
    "warmup",
    "steady-state-compute",
    "ipc-or-transfer",
    "audit",
    "shard-serialization-fsync-and-hash",
    "final-aggregation",
    "cleanup"
  ],
  "workloads": [
    {
      "workloadId": "HW2R-R0-U32-EXECUTION-FRAMEWORK-SMOKE-v1",
      "role": "device-worker-ipc-and-evidence-smoke-only",
      "diameterCells": null,
      "finalSelectionEligible": false,
      "scientificValues": false,
      "requiredOperations": [
        "worker-or-process-launch",
        "ipc",
        "device-call-when-available",
        "exact-summary",
        "evidence-envelope"
      ]
    },
    {
      "workloadId": "HW2R-R1-D54-A8R-OPERATION-GRAPH-SURROGATE-v1",
      "role": "candidate-scaled-representative-operation-graph",
      "diameterCells": 54,
      "finalSelectionEligible": true,
      "scientificValues": false,
      "requiredOperations": [
        "float64-d2q9-layout",
        "mrt-collision",
        "guo-forcing",
        "brinkman-mask-and-force",
        "scatter-streaming",
        "open-periodic-crossflow-boundary",
        "analysis-pre-and-post-population-copy",
        "independent-raw-force-identity",
        "a2-recomposition",
        "field-diagnostic",
        "compact-trace",
        "atomic-shard-hash"
      ]
    },
    {
      "workloadId": "HW2R-R2-EIGHT-CASE-COST-STRUCTURE-SURROGATE-v1",
      "role": "case-scheduling-memory-and-aggregation-representative",
      "diameterCells": null,
      "finalSelectionEligible": true,
      "scientificValues": false,
      "caseStructure": {
        "caseCount": 8,
        "diameterCounts": {
          "24": 2,
          "36": 2,
          "54": 4
        },
        "maskHalfThicknesses": [0.5, 0.75],
        "phaseCounts": {
          "baseline": 6,
          "minus-half-cell": 2
        }
      },
      "requiredOperations": [
        "one-two-three-four-and-memory-safe-worker-schedules",
        "cost-aware-order",
        "completion-order-permutation",
        "atomic-shard-validation",
        "deterministic-aggregation",
        "scheduling-hole-measurement",
        "load-imbalance-measurement",
        "peak-memory-measurement"
      ]
    }
  ],
  "candidateMatrix": {
    "allClassesMustReachTerminalClassification": true,
    "classes": [
      "trajectory-process-parallel",
      "single-trajectory-cpu-domain-or-thread",
      "native-or-wasm-simd",
      "gpu-compute",
      "cpu-gpu-hybrid",
      "data-layout-shard-aggregation"
    ],
    "cpuPhysicalCoreCounts": [1, 2, 4, 8, 12, 16],
    "cpuLogicalThreadCountsConditional": [24, 32],
    "nodeWorkerCounts": [1, 2, 4, 8, 12, 16],
    "caseProcessCounts": [1, 2, 3, 4, "memory-safe-maximum"],
    "pinningLayouts": [
      "unpinned",
      "single-ccd-or-l3",
      "balanced-across-ccd-or-l3"
    ],
    "gpuModes": [
      "persistent-context-persistent-buffers-batched-kernel"
    ],
    "hybridCpuFractions": [0.25, 0.5, 0.75],
    "hybridSplitResultBlind": true,
    "costAwareSchedulingRequired": true
  },
  "telemetry": {
    "cpu": [
      "assigned-utilization",
      "system-utilization",
      "frequency",
      "throttle",
      "temperature",
      "rss",
      "cgroup-memory-current",
      "cgroup-memory-peak",
      "memory-events",
      "swap"
    ],
    "gpu": [
      "device-side-event-time",
      "busy",
      "memory-used",
      "power",
      "temperature",
      "clock",
      "throttle",
      "h2d",
      "d2h",
      "synchronization"
    ],
    "gpuValidSamplesMinimum": 30,
    "higherFrequencyDeviceCounterAllowed": true,
    "persistentContextRequired": true,
    "persistentBuffersRequired": true
  },
  "correctness": {
    "exactSummaryAcrossAllRepeats": true,
    "sourceAndWorkloadHashesRequired": true,
    "h2xOrFullH2nRequiredForFinalSelection": true,
    "executionFieldsExcludedFromScientificPayload": true,
    "silentFallbackForbidden": true
  },
  "safety": {
    "dedicatedFiniteMemoryCgroupRequired": true,
    "systemReserveBytesMinimum": 4294967296,
    "systemReserveMemTotalFraction": 0.25,
    "candidateHeadroomFraction": 0.1,
    "swapGrowthMaximumBytes": 0,
    "oomEventGrowthMaximum": 0,
    "memoryHighEventGrowthMaximum": 0,
    "unrelatedProcessMutationForbidden": true,
    "foreignGpuProcessDisposition": "DEFERRED-UNSAFE-TO-PROBE",
    "thermalThrottleInvalidatesBatch": true,
    "frequencyDropFractionMaximum": 0.15
  },
  "selection": {
    "classificationOrder": [
      "static-accessibility",
      "measurement-validity",
      "correctness",
      "safety",
      "numerical-identity",
      "utilization-or-saturation",
      "performance",
      "best-throughput-among-all-qualified",
      "within-95-percent-of-best",
      "tie-break"
    ],
    "candidateTerminalStates": [
      "QUALIFIED",
      "MEASUREMENT_INVALID",
      "CORRECTNESS_NO_GO",
      "SAFETY_NO_GO",
      "NUMERICAL_IDENTITY_NO_GO",
      "UTILIZATION_NO_GO",
      "PERFORMANCE_NO_GO",
      "DEFERRED-UNAVAILABLE",
      "DEFERRED-UNSAFE-TO-PROBE"
    ],
    "representativeSpeedupMinimum": 1.5,
    "selectedThroughputFractionOfBestMinimum": 0.95,
    "unresolvedMaterialGainFractionMaximum": 0.1,
    "adjacentCpuGainAtSaturationMaximum": 0.05,
    "repeatWallTimeCvMaximum": 0.05,
    "repeatSlowestFastestRatioMaximum": 1.1,
    "soakThroughputDegradationMaximum": 0.1,
    "tieBreakOrder": [
      "lower-scientific-semantic-risk",
      "lower-memory",
      "lower-governance-complexity",
      "deterministic-candidate-id"
    ],
    "failClosedIfMaterialMeasurementInvalidCandidateExists": true,
    "v1OpenmpW02SelectionForbidden": true
  },
  "entryGate": {
    "requiredPassCodes": [
      "PASS-R1I-INTERRUPTED-SERIAL-ATTEMPT-EVIDENCE-SEALED",
      "PASS-G1-RESULT-BEFORE-FOUNDATION",
      "PASS-HW1-V2-RESULT-BEFORE-FOUNDATION"
    ],
    "noActiveResultBearingRunRequired": true,
    "inventoryRequired": true,
    "safeResourceWindowRequired": true,
    "cleanMainParityRequired": true,
    "contractTestAndImplementationCommitsPushedRequired": true,
    "automaticUnlockOnlyWhenAllConditionsPass": true
  },
  "failureCodes": [
    "MEASUREMENT_INVALID-WORKLOAD-TOO-SHORT",
    "MEASUREMENT_INVALID-WORKLOAD-TOO-LONG",
    "MEASUREMENT_INVALID-INSUFFICIENT-TELEMETRY",
    "MEASUREMENT_INVALID-LIFECYCLE-MISMATCH",
    "NO-GO-HW2R-CORRECTNESS",
    "NO-GO-HW2R-NUMERICAL-IDENTITY",
    "NO-GO-HW2R-RESOURCE-SAFETY",
    "NO-GO-HW2R-UTILIZATION",
    "NO-GO-HW2R-PERFORMANCE",
    "DEFERRED-HW2R-CANDIDATE-UNAVAILABLE",
    "DEFERRED-UNSAFE-TO-PROBE",
    "INCONCLUSIVE-HW2R-MEASUREMENT-OR-RESOURCE"
  ],
  "passCode": "PASS-HW2R-REPRESENTATIVE-MEASUREMENT",
  "conclusionCeiling": "hardware-measurement-candidate-only-no-scientific-conclusion",
  "stopState": "READY-FOR-PR2B-H3-UNLOCK-REVIEW"
}
